{
  "schema": "orchestella.fastlane.dv01.run.v1",
  "mode": "preflight",
  "alias": "qa-device",
  "outcome": "PREFLIGHT_TERMINAL_OK",
  "reason_code": null,
  "report_path": "report.json",
  "report_sha256": "affe84b993a741429cf55a1571a3e94ea0269c98ac53d974a36fa678e9d70cfc",
  "apk_sha256": "aaaaaaaaaaaaaaaaaaaaaaaaaaaaaaaaaaaaaaaaaaaaaaaaaaaaaaaaaaaaaaaa",
  "test_apk_sha256": "bbbbbbbbbbbbbbbbbbbbbbbbbbbbbbbbbbbbbbbbbbbbbbbbbbbbbbbbbbbbbbbb",
  "started_at_utc": "2026-10-22T09:59:00Z",
  "finished_at_utc": "2026-10-22T10:02:00Z",
  "adb_invoked": true,
  "serial_recorded": false
}
